{
  "schema_version": "1.0.0",
  "template_id": "scene_builder_v1",
  "renderer_version": "1.0.0",
  "ui_locale": "vi-VN",
  "interaction": {
    "input_modes": [
      "tap",
      "keyboard",
      "drag"
    ],
    "max_answer_tokens": 12
  },
  "game_id": "11111111-1111-4111-8111-111111111111",
  "target_language": "ja",
  "title_vi": "Đi học bằng xe đạp",
  "objective_vi": "Biểu đạt phương tiện và nơi đến trong câu lịch sự hiện tại.",
  "prompt_vi": "Ghép câu phù hợp với cảnh: người nói đi xe đạp đến trường.",
  "source_refs": [
    {
      "item_id": "21111111-1111-4111-8111-111111111111",
      "revision_id": "31111111-1111-4111-8111-111111111111"
    }
  ],
  "scene": {
    "description_vi": "Một người đi xe đạp đến trường.",
    "nodes": [
      {
        "id": "node_person",
        "icon_id": "person",
        "label_vi": "Người nói"
      },
      {
        "id": "node_bicycle",
        "icon_id": "bicycle",
        "label_vi": "Xe đạp"
      },
      {
        "id": "node_school",
        "icon_id": "school",
        "label_vi": "Trường học"
      }
    ],
    "edges": [
      {
        "from": "node_person",
        "to": "node_bicycle",
        "relation": "travels_by"
      },
      {
        "from": "node_person",
        "to": "node_school",
        "relation": "goes_to"
      }
    ]
  },
  "tokens": [
    {
      "id": "tok_watashi",
      "text": "私",
      "reading": "わたし"
    },
    {
      "id": "tok_wa",
      "text": "は"
    },
    {
      "id": "tok_bicycle",
      "text": "自転車",
      "reading": "じてんしゃ"
    },
    {
      "id": "tok_de",
      "text": "で"
    },
    {
      "id": "tok_school",
      "text": "学校",
      "reading": "がっこう"
    },
    {
      "id": "tok_ni",
      "text": "に"
    },
    {
      "id": "tok_he",
      "text": "へ"
    },
    {
      "id": "tok_go",
      "text": "行きます",
      "reading": "いきます"
    },
    {
      "id": "tok_bus",
      "text": "バス"
    },
    {
      "id": "tok_wo",
      "text": "を"
    }
  ]
}